{
  "database_count": 19,
  "databases": [
    {
      "base_include_test_status": "not_tested",
      "byte_size": 52994,
      "compatibility_status": "compatible",
      "database_family": "pitzer",
      "database_sha256": "eaa4cede7a907447156f4b5ff53880ac693b2c7de6765198eb048addb2dfcf83",
      "filename": "Amm.dat",
      "limitations": [
        "Standalone syntax/load smoke passed with PHREEQC 3.8.6-17100; scientific validity remains database- and temperature-specific."
      ],
      "master_species_count": 50,
      "master_species_names_sha256": "fff2afaa5027273ede69350d05de7811712615c8a2e451bd81cb9adc175a8c86",
      "parsed_summary_sha256": "85cc79f872aab356ce8d93bb79dab9f06b6c83b045f21ea8e6505b52581609e0",
      "phase_count": 88,
      "phase_names_sha256": "a9a8e5ba0e2f36e2e9f34cdc8fe13e4212b7ffcc5b1535dcc11fd73ecafe476e",
      "requires_database_family": "",
      "requires_database_filename": "",
      "resource_id": "usgs.phreeqc.database.amm",
      "resource_kind": "phreeqc_official_database",
      "sections": [
        "END",
        "EXCHANGE_MASTER_SPECIES",
        "EXCHANGE_SPECIES",
        "PHASES",
        "RATES",
        "SOLUTION_MASTER_SPECIES",
        "SOLUTION_SPECIES",
        "SURFACE_MASTER_SPECIES",
        "SURFACE_SPECIES"
      ],
      "solution_species_count": 226,
      "solution_species_names_sha256": "341387f476dc60b6512de951667e069ea630fb2f6151b67faaffa2e28bc345b5",
      "standalone_test_status": "passed",
      "test_status": "passed"
    },
    {
      "base_include_test_status": "not_tested",
      "byte_size": 13397,
      "compatibility_status": "compatible",
      "database_family": "pitzer",
      "database_sha256": "e03e02c35ed15796d7c85213ad6280e7585ee8c74909f739950f4d07e5337f7d",
      "filename": "ColdChem.dat",
      "limitations": [
        "Standalone syntax/load smoke passed with PHREEQC 3.8.6-17100; scientific validity remains database- and temperature-specific."
      ],
      "master_species_count": 12,
      "master_species_names_sha256": "10f49dacbe266c250351f749e4810011907d4a844c2138096cfb34575e0fb829",
      "parsed_summary_sha256": "881b3f09058114fb14e0de98a95090bd2c8a154ce8c7e5fc9ae79a5d2376d321",
      "phase_count": 33,
      "phase_names_sha256": "669bf793e297dbad555609014bff45b72a0c260a8155358ef17bd4cbba46ca77",
      "requires_database_family": "",
      "requires_database_filename": "",
      "resource_id": "usgs.phreeqc.database.coldchem",
      "resource_kind": "phreeqc_official_database",
      "sections": [
        "PHASES",
        "PITZER",
        "SOLUTION_MASTER_SPECIES",
        "SOLUTION_SPECIES"
      ],
      "solution_species_count": 9,
      "solution_species_names_sha256": "6b541de7a28bd8dba04e4a3e40a61c45effac333414ef306880e0f679bd236d9",
      "standalone_test_status": "passed",
      "test_status": "passed"
    },
    {
      "base_include_test_status": "passed",
      "byte_size": 5429,
      "compatibility_status": "compatible",
      "database_family": "unknown",
      "database_sha256": "ffe41089321b5be71eb76be57c0838f122e858e62dbf5ec5725e01adedcc2c02",
      "filename": "Concrete_PHR.dat",
      "limitations": [
        "Standalone loading is not applicable; reviewed explicit INCLUDE$ compatibility passed with phreeqc.dat.",
        "The extension must not be concatenated automatically with any database."
      ],
      "master_species_count": 0,
      "master_species_names_sha256": "4f53cda18c2baa0c0354bb5f9a3ecbe5ed12ab4d8e11ba873c2f11161202b945",
      "parsed_summary_sha256": "21f6aac4acea8ffdf8552283aed625c91e1d58d3b49a728816c583b14582205b",
      "phase_count": 30,
      "phase_names_sha256": "ff10961274b48e351f384f4098da522e93e2605a770aa544c2d8f125a193a737",
      "requires_database_family": "phreeqc",
      "requires_database_filename": "phreeqc.dat",
      "resource_id": "usgs.phreeqc.database.concrete-phr",
      "resource_kind": "database_extension",
      "sections": [
        "PHASES"
      ],
      "solution_species_count": 0,
      "solution_species_names_sha256": "4f53cda18c2baa0c0354bb5f9a3ecbe5ed12ab4d8e11ba873c2f11161202b945",
      "standalone_test_status": "not_applicable_requires_base",
      "test_status": "not_applicable_requires_base"
    },
    {
      "base_include_test_status": "passed",
      "byte_size": 6685,
      "compatibility_status": "compatible",
      "database_family": "pitzer",
      "database_sha256": "ef0f8de173b30609c50bb405c04f6447a6d0382f667536571ea62dda953aebaf",
      "filename": "Concrete_PZ.dat",
      "limitations": [
        "Standalone loading is not applicable; reviewed explicit INCLUDE$ compatibility passed with pitzer.dat.",
        "The extension must not be concatenated automatically with any database."
      ],
      "master_species_count": 3,
      "master_species_names_sha256": "754fa8b06216eea62ad31ab17a01665ed28eec769405c1555380ae70d068afc3",
      "parsed_summary_sha256": "3c1b59bd87155e6926d6d7404e0d2711f5fcad307919df5345787b19551148c6",
      "phase_count": 28,
      "phase_names_sha256": "902f874bd76683027039ca8a74c5b5afeb7a3cc6f32f7ff4886817602170f40c",
      "requires_database_family": "pitzer",
      "requires_database_filename": "pitzer.dat",
      "resource_id": "usgs.phreeqc.database.concrete-pz",
      "resource_kind": "database_extension",
      "sections": [
        "END",
        "PHASES",
        "PITZER",
        "SOLUTION_MASTER_SPECIES",
        "SOLUTION_SPECIES"
      ],
      "solution_species_count": 3,
      "solution_species_names_sha256": "6f1b81811e7a871e2d2a3e5e82e5bc62b636ca75c6a98c2bfbad3bb537573bc3",
      "standalone_test_status": "not_applicable_requires_base",
      "test_status": "not_applicable_requires_base"
    },
    {
      "base_include_test_status": "not_tested",
      "byte_size": 370257,
      "compatibility_status": "compatible",
      "database_family": "llnl",
      "database_sha256": "7ee972347f8791c900adbf86cffbb350e86ccfec3a7aa7160683ee9864f516a8",
      "filename": "Kinec.v2.dat",
      "limitations": [
        "Standalone syntax/load smoke passed with PHREEQC 3.8.6-17100; scientific validity remains database- and temperature-specific."
      ],
      "master_species_count": 93,
      "master_species_names_sha256": "8be941afa7e6070134a8c64c491d3b8667ccc22dc7ecdacadc1e0e74d9260f49",
      "parsed_summary_sha256": "4e3426d5ce2b8bc42c3d91d4c32f2a957e5e172a6771c74b154d495822b2695d",
      "phase_count": 419,
      "phase_names_sha256": "284db0559ffa18c76d9a548a0f39e4cd12ead50a8cd5025b1a3b876099aef2a3",
      "requires_database_family": "",
      "requires_database_filename": "",
      "resource_id": "usgs.phreeqc.database.kinec-v2",
      "resource_kind": "phreeqc_official_database",
      "sections": [
        "PHASES",
        "RATES",
        "SOLUTION_MASTER_SPECIES",
        "SOLUTION_SPECIES"
      ],
      "solution_species_count": 288,
      "solution_species_names_sha256": "18de96e0dfc2b7b25b4fafeca6a4e9a31c10264998121ce4e19381a2efbd2bc5",
      "standalone_test_status": "passed",
      "test_status": "passed"
    },
    {
      "base_include_test_status": "not_tested",
      "byte_size": 380475,
      "compatibility_status": "compatible",
      "database_family": "llnl",
      "database_sha256": "5aa68b4b86503d7ef592c36ef0b3d8534ddec1dbecf0a9087e51164f0adf2c77",
      "filename": "Kinec_v3.dat",
      "limitations": [
        "Standalone syntax/load smoke passed with PHREEQC 3.8.6-17100; scientific validity remains database- and temperature-specific."
      ],
      "master_species_count": 93,
      "master_species_names_sha256": "8be941afa7e6070134a8c64c491d3b8667ccc22dc7ecdacadc1e0e74d9260f49",
      "parsed_summary_sha256": "949193fb8ebe6a22236f38954db5926fa3fc4b47dd4a7242b00a05b26bfc97da",
      "phase_count": 419,
      "phase_names_sha256": "284db0559ffa18c76d9a548a0f39e4cd12ead50a8cd5025b1a3b876099aef2a3",
      "requires_database_family": "",
      "requires_database_filename": "",
      "resource_id": "usgs.phreeqc.database.kinec-v3",
      "resource_kind": "phreeqc_official_database",
      "sections": [
        "PHASES",
        "RATES",
        "SOLUTION_MASTER_SPECIES",
        "SOLUTION_SPECIES"
      ],
      "solution_species_count": 288,
      "solution_species_names_sha256": "18de96e0dfc2b7b25b4fafeca6a4e9a31c10264998121ce4e19381a2efbd2bc5",
      "standalone_test_status": "passed",
      "test_status": "passed"
    },
    {
      "base_include_test_status": "not_tested",
      "byte_size": 698065,
      "compatibility_status": "compatible",
      "database_family": "llnl",
      "database_sha256": "cfb1dbe03bc2744e622ee9544be628d051beda4f0de8a218afeddd62ad781aee",
      "filename": "PHREEQC_ThermoddemV1.10_15Dec2020.dat",
      "limitations": [
        "Standalone syntax/load smoke passed with PHREEQC 3.8.6-17100; scientific validity remains database- and temperature-specific."
      ],
      "master_species_count": 209,
      "master_species_names_sha256": "3566361fc622d2a24d48bb1b0b8730b709a1ce324de83c924b4f3d88c6652c1f",
      "parsed_summary_sha256": "04408bf2d564c8fe6fd776c051b0aa66e78e399ee2342718f76bbed8de96f43c",
      "phase_count": 761,
      "phase_names_sha256": "9d1a15d65007321003e49c8f6d8f88b37750d8ed4f275f546e9f6626bd149e68",
      "requires_database_family": "",
      "requires_database_filename": "",
      "resource_id": "usgs.phreeqc.database.phreeqc-thermoddemv1-10-15dec2020",
      "resource_kind": "phreeqc_official_database",
      "sections": [
        "END",
        "NAMED_EXPRESSIONS",
        "PHASES",
        "SOLUTION_MASTER_SPECIES",
        "SOLUTION_SPECIES"
      ],
      "solution_species_count": 836,
      "solution_species_names_sha256": "4ab72098453f9d5c0d7775350f9a4ee6cba446cbc11701e56dfcdd7a5109382e",
      "standalone_test_status": "passed",
      "test_status": "passed"
    },
    {
      "base_include_test_status": "not_tested",
      "byte_size": 92566,
      "compatibility_status": "compatible",